Symbol,Name,LastSale,NetChange,PercentChange,MarketCap,Country,IPOYear,Volume,Sector,Industry
RLI,RLI Corp. Common Stock (DE),$103.78,0.46,0.445%,4675824920.00,United States,,38090,Finance,Property-Casualty Insurers
RLJ,RLJ Lodging Trust Common Shares of Beneficial Interest $0.01 par value,$14.33,0.08,0.561%,2364763025.00,United States,2011,286616,Consumer Services,Real Estate Investment Trusts
RM,Regional Management Corp. Common Stock,$28.59,0.28,0.989%,324089979.00,United States,2012,14845,Finance,Finance: Consumer Services
RMD,ResMed Inc. Common Stock,$212.42,2.44,1.162%,30782876800.00,United States,,99574,Health Care,Medical/Dental Instruments
RMT,Royce Micro-Cap Trust Inc. Common Stock,$10.21,0.07,0.69%,440040065.00,United States,,70900,,
RNGR,Ranger Energy Services Inc. Class A Common Stock,$3.78,-0.02,-0.526%,58192782.00,United States,2017,17239,Energy,Oilfield Services/Equipment
RNP,Cohen & Steers REIT and Preferred and Income Fund Inc. Common Shares,$21.89,0.16,0.736%,1041574205.00,United States,2003,39770,,
ROG,Rogers Corporation Common Stock,$151.26,-0.76,-0.50%,2824901205.00,United States,,31575,Basic Industries,Major Chemicals
ROK,Rockwell Automation Inc. Common Stock,$248.63,0.60,0.242%,28885517143.00,United States,,131852,Capital Goods,Industrial Machinery/Components
ROL,Rollins Inc. Common Stock,$40.05,0.21,0.527%,19689521696.00,United States,,412010,Finance,Diversified Commercial Services
ROP,Roper Technologies Inc. Common Stock,$420.12,0.66,0.157%,44058976303.00,United States,1992,119734,Capital Goods,Industrial Machinery/Components
RPAI,Retail Properties of America Inc. Class A Common Stock,$8.60,0.12,1.415%,1842572592.00,United States,2012,359342,Consumer Services,Real Estate Investment Trusts
RPM,RPM International Inc. Common Stock,$90.06,0.67,0.75%,11702136667.00,United States,,121170,Basic Industries,Paints/Coatings
RPT,RPT Realty Common Stock,$8.50,0.22,2.657%,688176184.00,United States,,312950,Consumer Services,Real Estate Investment Trusts
RQI,Cohen & Steers Quality Income Realty Fund Inc Common Shares,$11.95,0.03,0.252%,1604206587.00,United States,2002,145990,,
RRC,Range Resources Corporation Common Stock,$7.03,-0.33,-4.484%,1802023275.00,United States,,1875476,Energy,Oil & Gas Production
RRD,R.R. Donnelley & Sons Company Common Stock,$2.03,0.01,0.495%,144942000.00,United States,,215292,Miscellaneous,Publishing
RS,Reliance Steel & Aluminum Co. Common Stock (DE),$118.12,-0.36,-0.304%,7530892620.00,United States,1994,67243,Basic Industries,Metal Fabrications
RSG,Republic Services Inc. Common Stock,$95.63,0.62,0.653%,30479641627.00,United States,1998,307177,Public Utilities,Environmental Services
RTP,Reinvent Technology Partners Class A Ordinary Shares,$11.75,0.05,0.427%,1013437500.00,United States,2020,295640,Finance,Business Services
RTP.U,Reinvent Technology Partners Units each consisting of one Class A ordinary share and one-fourth of one redeemable warrant,NA,,,,United States,2020,0,,
RTP.WS,Reinvent Technology Partners Redeemable Warrants each whole warrant exercisable for one Class A ordinary share at an exercise price of $11.50,NA,,,,United States,,0,,
RTPZ.U,Reinvent Technology Partners Z Unit,NA,,,,United States,2020,0,,
RTX,Raytheon Technologies Corporation Common Stock,$70.27,-0.45,-0.636%,106720203255.00,United States,,1758644,Capital Goods,Aerospace
RVI,Retail Value Inc. Common Stock ,$14.50,0.28,1.969%,287524328.00,United States,2018,142355,Finance,Real Estate
RVT,Royce Value Trust Inc. Common Stock,$16.36,0.08,0.491%,1643717028.00,United States,1986,169528,,
RWT,Redwood Trust Inc. Common Stock,$8.90,-0.03,-0.336%,996159378.00,United States,1995,532013,Consumer Services,Real Estate Investment Trusts
RXN,Rexnord Corporation Common Stock,$39.23,0.35,0.90%,4718578476.00,United States,2012,270630,Technology,Industrial Machinery/Components
RYAM,Rayonier Advanced Materials Inc. Common Stock,$6.41,0.09,1.424%,406041238.00,United States,2014,425793,Basic Industries,Paper
RYI,Ryerson Holding Corporation Common Stock,$12.32,0.02,0.163%,469606331.00,United States,2014,25421,Basic Industries,Metal Fabrications
RYN,Rayonier Inc. REIT Common Stock,$29.59,0.03,0.101%,4039574988.00,United States,,107045,Consumer Services,Real Estate Investment Trusts
RZA,Reinsurance Group of America Incorporated 6.20% Fixed-to-Floating Rate Subordinated Debentures due 2042,$28.12,0.25,0.897%,0.00,United States,,16454,Finance,Life Insurance
RZB,Reinsurance Group of America Incorporated 5.75% Fixed-To-Floating Rate Subordinated Debentures due 2056,$28.89,0.24,0.838%,0.00,United States,2016,24919,Finance,Life Insurance
SAF,Saratoga Investment Corp 6.25% Notes due 2023,$25.13,-0.08,-0.317%,0.00,United States,2018,8525,,
SAFE,Safehold Inc. Common Stock,$74.00,0.96,1.314%,3928338100.00,United States,2017,25141,Consumer Services,Real Estate
SAH,Sonic Automotive Inc. Common Stock,$38.21,0.02,0.052%,1606729201.00,United States,1997,93115,Consumer Durables,Automotive Aftermarket
SAIL,SailPoint Technologies Holdings Inc. Common Stock,$56.43,-0.15,-0.265%,5130190061.00,United States,2017,269092,Technology,Computer Software: Prepackaged Software
SAK,Saratoga Investment Corp 7.25% Notes due 2025,$25.97,0.05,0.193%,0.00,United States,2020,700,,
SAM,Boston Beer Company Inc. (The) Common Stock,$1014.93,-9.11,-0.89%,12425390137.00,United States,,38544,Consumer Non-Durables,Beverages (Production/Distribution)
SAR,Saratoga Investment Corp New,$20.72,-0.25,-1.192%,231531952.00,United States,,24581,,
SAVE,Spirit Airlines Inc. Common Stock,$24.42,-0.13,-0.53%,2385303231.00,United States,,2618194,Transportation,Air Freight/Delivery Services
SBH,Sally Beauty Holdings Inc. (Name to be changed from Sally Holdings Inc.) Common Stock,$12.65,-0.13,-1.017%,1427101350.00,United States,,854019,Consumer Services,Other Specialty Stores
SBI,Western Asset Intermediate Muni Fund Inc Common Stock,$9.11,-0.01,-0.11%,128289890.00,United States,1992,4189,,
SBR,Sabine Royalty Trust Common Stock,$28.675,0.00,0.00%,418062718.00,United States,,23066,Energy,Oil & Gas Production
SCA,Stellus Capital Investment Corporation 5.75% Notes due 2022,$25.09,-0.22,-0.869%,0.00,United States,,1096,,
SCCO,Southern Copper Corporation Common Stock,$64.10,-0.31,-0.481%,49553996543.00,United States,,365208,Basic Industries,Precious Metals
SCD,LMP Capital and Income Fund Inc. Common Stock,$11.58,0.01,0.086%,208246961.00,United States,2004,31631,,
SCHW,Charles Schwab Corporation (The) Common Stock,$52.06,-0.29,-0.554%,97824778867.00,United States,,1633112,Finance,Investment Bankers/Brokers/Service
SCI,Service Corporation International Common Stock,$48.74,-0.04,-0.082%,8419524477.00,United States,,153934,Consumer Services,Other Consumer Services
SCL,Stepan Company Common Stock,$117.66,1.08,0.926%,2642812795.00,United States,,27052,Basic Industries,Package Goods/Cosmetics
SCM,Stellus Capital Investment Corporation Common Stock,$10.74,-0.10,-0.923%,209279672.00,United States,2012,59704,,
SCS,Steelcase Inc. Common Stock,$13.49,0.42,3.213%,1550118039.00,United States,1998,572901,Consumer Durables,Office Equipment/Supplies/Services
SCU,Sculptor Capital Management Inc. Class A Common Stock,$15.32,0.45,3.026%,848751547.00,United States,,62514,Finance,Investment Managers
SCX,L.S. Starrett Company (The) Common Stock,$4.02,0.02,0.50%,28485780.00,United States,,3417,Capital Goods,Industrial Machinery/Components
SE,Sea Limited American Depositary Shares each representing one Class A Ordinary Share,$193.18,-1.89,-0.969%,97973896123.00,United States,2017,1132200,Consumer Services,Other Consumer Services
SEAH,Sports Entertainment Acquisition Corp. Class A Common Stock,$10.18,-0.01,-0.098%,572625000.00,United States,2020,156385,Finance,Business Services
SEAH.U,Sports Entertainment Acquisition Corp. Units each consisting of one share of Class A Common Stock and one-half of one redeemable Warrant,NA,,,,United States,2020,0,,
SEAH.WS,Sports Entertainment Acquisition Corp. Redeemable Warrants each whole Warrant exercisable for one share of Class A Common Stock each at an exercise price of $11.50 per share,NA,,,,United States,,0,,
SEAS,SeaWorld Entertainment Inc. Common Stock,$30.56,-0.56,-1.799%,2395348022.00,United States,2013,270835,Consumer Services,Services-Misc. Amusement & Recreation
SEE,Sealed Air Corporation Common Stock,$46.10,-0.14,-0.303%,7152564272.00,United States,,252806,Basic Industries,Major Chemicals
SEM,Select Medical Holdings Corporation Common Stock,$26.96,-0.07,-0.259%,3633207514.00,United States,2009,126670,Health Care,Hospital/Nursing Management
SF,Stifel Financial Corporation Common Stock,$51.20,0.40,0.787%,5273804288.00,United States,,204227,Finance,Investment Bankers/Brokers/Service
SFB,Stifel Financial Corporation 5.20% Senior Notes due 2047,$26.64,0.10,0.377%,0.00,United States,2017,6154,Finance,Investment Bankers/Brokers/Service
SFE,Safeguard Scientifics Inc. New Common Stock,$6.30,0.05,0.80%,131626297.00,United States,,23419,Finance,Finance/Investors Services
SGU,Star Group L.P. Common Stock,$9.50,0.00,0.00%,393933384.00,United States,,43978,Consumer Services,Other Specialty Stores
SHAK,Shake Shack Inc. Class A Common Stock,$87.80,-0.05,-0.057%,3653457126.00,United States,2015,256037,Consumer Services,Restaurants
SHLX,Shell Midstream Partners L.P. Common Units representing Limited Partner Interests,$10.08,-0.04,-0.395%,3964358533.00,United States,2014,503820,Energy,Natural Gas Distribution
SHO,Sunstone Hotel Investors Inc. Sunstone Hotel Investors Inc. Common Shares,$11.35,0.14,1.249%,2447463493.00,United States,2004,1047936,Consumer Services,Hotels/Resorts
SHW,Sherwin-Williams Company (The) Common Stock,$733.90,9.45,1.304%,66656104953.00,United States,,108650,Consumer Services,RETAIL: Building Materials
SI,Silvergate Capital Corporation Class A Common Stock,$63.57,-2.67,-4.031%,1191318773.00,United States,2019,547443,Finance,Major Banks
SITC,SITE Centers Corp. Common Stock,$10.23,0.04,0.393%,1976638360.00,United States,,369199,Consumer Services,Real Estate Investment Trusts
SITE,SiteOne Landscape Supply Inc. Common Stock,$159.11,1.89,1.202%,7037591228.00,United States,2016,84035,Consumer Durables,Diversified Electronic Products
SIX,Six Flags Entertainment Corporation New Common Stock,$33.65,-0.39,-1.146%,2859478708.00,United States,,406735,Consumer Services,Services-Misc. Amusement & Recreation
SJI,South Jersey Industries Inc. Common Stock,$21.57,0.05,0.232%,2169732922.00,United States,,251584,Public Utilities,Oil/Gas Transmission
SJIJ,South Jersey Industries Inc. 5.625% Junior Subordinated Notes due 2079,$26.05,0.16,0.618%,0.00,United States,2019,6791,Public Utilities,Oil/Gas Transmission
SJIU,South Jersey Industries Inc. Corporate Units,$37.82,0.29,0.773%,0.00,United States,,637,Public Utilities,Oil/Gas Transmission
SJM,J.M. Smucker Company (The) New Common Stock,$116.09,0.92,0.799%,13245022007.00,United States,,254266,Consumer Non-Durables,Packaged Foods
SJT,San Juan Basin Royalty Trust Common Stock,$2.86,-0.07,-2.389%,133301157.00,United States,,50825,Energy,Oil & Gas Production
SJW,SJW Group Common Stock (DE),$67.13,0.58,0.872%,1916979586.00,United States,,30982,Public Utilities,Water Supply
SKT,Tanger Factory Outlet Centers Inc. Common Stock,$10.38,0.09,0.875%,970044953.00,United States,1993,1273725,Consumer Services,Real Estate Investment Trusts
SKX,Skechers U.S.A. Inc. Common Stock,$36.12,-0.52,-1.419%,5676427367.00,United States,1999,210122,Consumer Non-Durables,Shoe Manufacturing
SKY,Skyline Champion Corporation Common Stock,$31.65,0.17,0.54%,1792619159.00,United States,,83882,Basic Industries,Homebuilding
SLCA,U.S. Silica Holdings Inc. Common Stock,$7.13,-0.12,-1.655%,527263343.00,United States,2012,432011,Basic Industries,Mining & Quarrying of Nonmetallic Minerals (No Fuels)
SLG,SL Green Realty Corp Common Stock,$56.74,0.03,0.053%,4117596891.00,United States,1997,517483,Consumer Services,Real Estate Investment Trusts
SM,SM Energy Company Common Stock,$6.02,0.02,0.333%,689728256.00,United States,,2642925,Energy,Oil & Gas Production
SMAR,Smartsheet Inc. Class A Common Stock,$72.50,0.17,0.235%,8862973765.00,United States,2018,361666,Technology,Computer Software: Prepackaged Software
SMG,Scotts Miracle-Gro Company (The) Common Stock,$199.50,-0.10,-0.05%,11109902832.00,United States,1992,76724,Basic Industries,Agricultural Chemicals
SMLP,Summit Midstream Partners LP Common Units Representing Limited Partner Interests,$13.13,-0.12,-0.906%,49565645.00,United States,2012,82293,Public Utilities,Natural Gas Distribution
SMM,Salient Midstream Common Shares of Beneficial Interest,$4.32,-0.06,-1.37%,76560975.00,United States,2012,68844,,
SMP,Standard Motor Products Inc. Common Stock,$41.40,-0.12,-0.289%,929269120.00,United States,,116994,Capital Goods,Auto Parts:O.E.M.
SNA,Snap-On Incorporated Common Stock,$169.77,1.93,1.15%,9204005342.00,United States,,106437,Capital Goods,Industrial Machinery/Components
SNAP,Snap Inc. Class A Common Stock,$50.15,-1.59,-3.073%,74722529297.00,United States,2017,9450369,Technology,Computer Software: Programming Data Processing
SNDR,Schneider National Inc. Common Stock,$20.73,0.01,0.048%,3676282102.00,United States,2017,135168,Transportation,Trucking Freight/Courier Services
SNOW,Snowflake Inc. Class A Common Stock,$323.04,-8.61,-2.596%,91452624000.00,United States,2020,2191153,Technology,Computer Software: Prepackaged Software
SNPR,Tortoise Acquisition Corp. II Class A Ordinary Shares,$11.36,0.19,1.701%,489900000.00,United States,2020,567051,Finance,Business Services
SNPR.U,Tortoise Acquisition Corp. II Units,NA,,,,United States,2020,0,,
SNPR.WS,Tortoise Acquisition Corp. II Warrants each whole warrant exercisable for one Class A ordinary share at an exercise price of $11.50 per share,NA,,,,United States,,0,,
SNR,New Senior Investment Group Inc. Common Stock,$5.34,0.08,1.521%,443347338.00,United States,2014,135084,Consumer Services,Real Estate Investment Trusts
SNV,Synovus Financial Corp. Common Stock,$32.28,-0.41,-1.254%,4771186396.00,United States,,333996,Finance,Major Banks
SNX,Synnex Corporation Common Stock,$82.69,0.65,0.792%,10472217994.00,United States,2003,100341,Technology,Retail: Computer Software & Peripheral Equipment
SO,Southern Company (The) Common Stock,$59.80,0.42,0.707%,63163271181.00,United States,,857976,Public Utilities,Electric Utilities: Central
SOGO,Sogou Inc. American Depositary Shares each representing one Class A Ordinary Share,$8.17,-0.04,-0.487%,3166617784.00,United States,2017,383794,Technology,EDP Services
SOI,Solaris Oilfield Infrastructure Inc. Class A Common Stock,$8.30,-0.18,-2.123%,376245424.00,United States,2017,80683,Energy,Metal Fabrications
SOJB,Southern Company (The) Series 2016A 5.25% Junior Subordinated Notes due October 1 2076,$26.92,0.05,0.186%,0.00,United States,2016,11781,Public Utilities,Electric Utilities: Central
SOJC,Southern Company (The) Series 2017B 5.25% Junior Subordinated Notes due December 1 2077,$27.36,0.05,0.183%,0.00,United States,2017,11238,Public Utilities,Electric Utilities: Central
SOJD,Southern Company (The) Series 2020A 4.95% Junior Subordinated Notes due January 30 2080,$27.40,0.00,0.00%,0.00,United States,2020,63584,Public Utilities,Electric Utilities: Central
SOJE,Southern Company (The) Series 2020C 4.20% Junior Subordinated Notes due October 15 2060,$26.25,0.10,0.382%,0.00,United States,2020,51076,Public Utilities,Electric Utilities: Central
SOLN,Southern Company (The) 2019 Series A Corporate Units,$50.59,-0.09,-0.178%,0.00,United States,2019,14886,Public Utilities,Electric Utilities: Central
SON,Sonoco Products Company Common Stock,$59.43,0.12,0.202%,5967759251.00,United States,,146525,Consumer Durables,Containers/Packaging
SOR,Source Capital Inc. Common Stock,$40.07,-0.14,-0.348%,339652033.00,United States,,3201,,
SPB,Spectrum Brands Holdings Inc. Common Stock,$76.32,1.06,1.408%,3288047165.00,United States,,152628,Miscellaneous,Industrial Machinery/Components
SPE,Special Opportunities Fund Inc Common Stock,$13.90,-0.01,-0.072%,118163455.00,United States,,7875,,
SPG,Simon Property Group Inc. Common Stock,$84.37,0.72,0.861%,27684822761.00,United States,,810693,Consumer Services,Real Estate Investment Trusts
SPGI,S&P Global Inc. Common Stock,$316.58,2.95,0.941%,76168776019.00,United States,,490838,Finance,Finance: Consumer Services
SPH,Suburban Propane Partners L.P. Common Stock,$14.57,-0.12,-0.817%,910731813.00,United States,1996,130656,Consumer Services,Other Specialty Stores
SPLP,Steel Partners Holdings LP LTD PARTNERSHIP UNIT,$9.15,-0.05,-0.543%,230645651.00,United States,,37428,Capital Goods,Industrial Specialties
SPNV,Supernova Partners Acquisition Company Inc. Class A Common Stock,$11.17,0.09,0.812%,561990625.00,United States,2020,188264,Finance,Business Services
SPNV.U,Supernova Partners Acquisition Company Inc. Units each consisting of one share of Class A common stock and one-third of one warrant,NA,,,,United States,2020,0,,
SPNV.WS,Supernova Partners Acquisition Company Inc. Warrants each whole warrant exercisable for one share of Class A Common Stock at an exercise price of $11.50,NA,,,,United States,,0,,
SPR,Spirit Aerosystems Holdings Inc. Common Stock,$38.04,-0.42,-1.092%,4018441789.00,United States,2006,1367392,Capital Goods,Military/Government/Technical
SPRQ.U,Spartan Acquisition Corp. II Units,NA,,,,United States,2020,0,,
SPXC,SPX Corporation Common Stock,$53.91,0.44,0.823%,2414266355.00,United States,,65853,Technology,Industrial Machinery/Components
SPXX,Nuveen S&P 500 Dynamic Overwrite Fund,$14.90,0.09,0.608%,256157194.00,United States,,20519,,
SQ,Square Inc. Class A Common Stock,$228.28,-2.40,-1.04%,102939852704.00,United States,2015,8411200,Technology,Computer Software: Prepackaged Software
SQZ,SQZ Biotechnologies Company Common Stock,$27.50,0.28,1.029%,679716785.00,United States,2020,15387,Health Care,Biotechnology: Biological Products (No Diagnostic Substances)
SR,Spire Inc. Common Stock,$63.56,0.32,0.506%,3283278051.00,United States,,89247,Public Utilities,Oil/Gas Transmission
SRC,Spirit Realty Capital Inc. Common Stock,$40.29,0.70,1.768%,4603163362.00,United States,2013,205354,Consumer Services,Building operators
SRE,Sempra Energy Common Stock,$125.90,-0.05,-0.04%,36318403720.00,United States,,369762,Public Utilities,Natural Gas Distribution
SREA,Sempra Energy 5.750% Junior Subordinated Notes due 2079,$28.09,0.17,0.609%,0.00,United States,2019,38660,Public Utilities,Natural Gas Distribution
SRG,Seritage Growth Properties Class A Common Stock,$14.61,-0.14,-0.949%,840795770.00,United States,2015,298622,Finance,Real Estate
SRI,Stoneridge Inc. Common Stock,$29.64,-0.39,-1.299%,800435817.00,United States,1997,31269,Capital Goods,Auto Parts:O.E.M.
SRT,StarTek Inc. Common Stock,$7.59,-0.34,-4.288%,305822010.00,United States,1997,49382,Technology,Professional Services
SRV,Cushing MLP & Infrastructure Total Return Fund,$21.77,-0.08,-0.366%,47532400.00,United States,,14069,,
SSD,Simpson Manufacturing Company Inc. Common Stock,$92.89,0.33,0.357%,4033420255.00,United States,,40485,Capital Goods,Industrial Machinery/Components
SSTK,Shutterstock Inc. Common Stock,$71.76,0.22,0.308%,2599344253.00,United States,2012,118010,Technology,EDP Services
STAG,Stag Industrial Inc. Common Stock,$30.98,0.24,0.781%,4623152959.00,United States,2011,338595,Consumer Services,Real Estate Investment Trusts
STAR          ,iStar Inc. Common Stock,$14.99,0.14,0.943%,1108914061.00,United States,,104818,Consumer Services,Real Estate Investment Trusts
STC,Stewart Information Services Corporation Common Stock,$49.00,0.59,1.219%,1309247758.00,United States,,55390,Finance,Specialty Insurers
STE,STERIS plc (Ireland) Ordinary Shares,$186.19,2.03,1.102%,15886476677.00,United States,,97192,Health Care,Industrial Specialties
STK,Columbia Seligman Premium Technology Growth Fund Inc,$27.16,0.12,0.444%,431621614.00,United States,2009,28925,,
STL,Sterling Bancorp,$17.95,-0.27,-1.482%,3488772591.00,United States,,1714275,Finance,Major Banks
STON,StoneMor Inc. Common Stock,$2.54,-0.04,-1.55%,325568335.00,United States,2004,296793,Consumer Services,Other Consumer Services
STOR,STORE Capital Corporation Common Stock,$33.06,0.13,0.395%,8719763111.00,United States,2014,491658,Consumer Services,Real Estate Investment Trusts
STPK,Star Peak Energy Transition Corp. Class A Common Stock,$22.67,1.81,8.677%,1086984107.00,United States,2020,1314515,Finance,Business Services
STPK.U,Star Peak Energy Transition Corp. Units each consisting of one share of Class A common stock and one-third of one redeemable warrant,NA,,,,United States,2020,0,,
STPK.WS,Star Peak Energy Transition Corp. Warrants each whole warrant exercisable for one share of Class A common stock at an exercise price of $11.50,NA,,,,United States,,0,,
STT,State Street Corporation Common Stock,$71.78,0.20,0.279%,25323818547.00,United States,,665765,Finance,Major Banks
STWD,STARWOOD PROPERTY TRUST INC. Starwood Property Trust Inc.,$19.52,-0.19,-0.964%,5557102616.00,United States,2009,1356479,Consumer Services,Real Estate Investment Trusts
STZ,Constellation Brands Inc. Common Stock,$215.81,0.33,0.153%,41824041232.00,United States,,266940,Consumer Non-Durables,Beverages (Production/Distribution)
STZ/B,Constellation Brands Inc,$213.75,0.00,0.00%,,United States,,1,,
SUI,Sun Communities Inc. Common Stock,$147.14,2.04,1.406%,15826798043.00,United States,1993,205403,Consumer Services,Real Estate Investment Trusts
SUM,Summit Materials Inc. Class A Common Stock,$19.22,-0.09,-0.466%,2193534682.00,United States,2015,193899,Basic Industries,Mining & Quarrying of Nonmetallic Minerals (No Fuels)
SUN,Sunoco LP Common Units representing limited partner interests,$28.58,-0.14,-0.487%,2843705513.00,United States,2012,75002,Energy,Integrated oil Companies
SUP,Superior Industries International Inc. Common Stock (DE),$4.37,-0.07,-1.577%,111836734.00,United States,,131512,Capital Goods,Auto Parts:O.E.M.
SWI,SolarWinds Corporation Common Stock,$15.75,-0.26,-1.624%,4946163343.00,United States,2018,1507920,Technology,Computer Software: Prepackaged Software
SWK,Stanley Black & Decker Inc. Common Stock,$179.92,2.02,1.135%,28827375956.00,United States,,243183,Capital Goods,Industrial Machinery/Components
SWM,Schweitzer-Mauduit International Inc. Common Stock,$40.30,0.24,0.599%,1262330521.00,United States,,38881,Basic Industries,Paper
SWN,Southwestern Energy Company Common Stock,$3.39,-0.21,-5.833%,2286287336.00,United States,,11228965,Energy,Oil & Gas Production
SWT,Stanley Black & Decker Inc. Corporate Unit,$110.60,1.11,1.014%,0.00,United States,2019,4513,Capital Goods,Industrial Machinery/Components
SWX,Southwest Gas Holdings Inc. Common Stock (DE),$60.14,0.91,1.536%,3417777429.00,United States,,217039,Public Utilities,Oil & Gas Production
SWZ,Swiss Helvetia Fund Inc. (The) Common Stock,$8.76,0.07,0.806%,116175216.00,United States,,28096,,
SXC,SunCoke Energy Inc. Common Stock,$4.24,-0.05,-1.166%,350936638.00,United States,2011,682805,Basic Industries,Steel/Iron Ore
SXI,Standex International Corporation Common Stock,$76.01,0.57,0.756%,941022650.00,United States,,11580,Technology,Industrial Machinery/Components
SXT,Sensient Technologies Corporation Common Stock,$74.24,0.88,1.20%,3144583977.00,United States,,54400,Basic Industries,Major Chemicals
SYF,Synchrony Financial Common Stock,$33.96,-0.17,-0.498%,19825582671.00,United States,2014,844443,Finance,Finance: Consumer Services
SYK,Stryker Corporation Common Stock,$237.06,0.73,0.309%,89084933148.00,United States,,256448,Health Care,Medical/Dental Instruments
SYX,Systemax Inc. Common Stock,$36.25,0.00,0.00%,1356199863.00,United States,,32595,Capital Goods,Industrial Machinery/Components
SYY,Sysco Corporation Common Stock,$72.42,-0.45,-0.618%,36887753361.00,United States,,730194,Consumer Non-Durables,Food Distributors
T,AT&T Inc.,$28.69,-0.06,-0.209%,204444940000.00,United States,,19153092,Public Utilities,Telecommunications Equipment
TACA.U,Trepont Acquisition Corp I Units each consisting of one Class A ordinary share and one-half of one redeemable warrant,NA,,,,United States,2020,0,,
TBB,AT&T Inc. 5.350% Global Notes due 2066,$27.34,-0.06,-0.219%,0.00,United States,2017,43305,Public Utilities,Telecommunications Equipment
TBC,AT&T Inc. 5.625% Global Notes due 2067,$28.14,0.03,0.107%,0.00,United States,2018,36620,Public Utilities,Telecommunications Equipment
TBI,TrueBlue Inc. Common Stock,$19.18,0.00,0.00%,680367690.00,United States,,79213,Technology,Professional Services
TCI,Transcontinental Realty Investors Inc. Common Stock,$24.64,-0.86,-3.373%,214805779.00,United States,,523,Consumer Services,Real Estate Investment Trusts
TCO,Taubman Centers Inc. Common Stock,$42.95,-0.01,-0.023%,2651103783.00,United States,1992,771120,Consumer Services,Real Estate Investment Trusts
TCP,TC PipeLines LP Common Units representing Limited Partner Interests,$28.69,0.14,0.49%,2100291501.00,United States,,238810,Public Utilities,Natural Gas Distribution
TDA,Telephone and Data Systems Inc. 5.875% Senior Notes due 2061,$25.21,0.08,0.318%,0.00,United States,,2702,Public Utilities,Telecommunications Equipment
TDC,Teradata Corporation Common Stock,$22.38,-0.11,-0.489%,2446134000.00,United States,,1794585,Technology,Computer Software: Prepackaged Software
TDE,Telephone and Data Systems Inc. 6.875% Senior Notes due 2059,$25.58,0.03,0.117%,0.00,United States,,3453,Public Utilities,Telecommunications Equipment
TDF,Templeton Dragon Fund Inc. Common Stock,$21.42,-0.34,-1.563%,724084743.00,United States,,20739,,
TDG,Transdigm Group Incorporated Transdigm Group Inc. Common Stock,$606.71,-5.19,-0.848%,33026793968.00,United States,2006,47705,Capital Goods,Military/Government/Technical
TDI,Telephone and Data Systems Inc. Sr Nt,$27.37,0.17,0.625%,0.00,United States,,431,Public Utilities,Telecommunications Equipment
