Symbol,Name,LastSale,NetChange,PercentChange,MarketCap,Country,IPOYear,Volume,Sector,Industry
CMSD,CMS Energy Corporation 5.875% Junior Subordinated Notes due 2079,$27.93,0.23,0.83%,0.00,United States,2019,18937,Public Utilities,Power Generation
CMU,MFS Municipal Income Trust Common Stock,$4.39,0.04,0.92%,124348128.00,United States,1987,85349,,
CNA,CNA Financial Corporation Common Stock,$38.64,0.16,0.416%,10486458518.00,United States,,69140,Finance,Property-Casualty Insurers
CNC,Centene Corporation Common Stock,$58.02,-0.66,-1.125%,33639861510.00,United States,,1509670,Health Care,Medical Specialities
CNK,Cinemark Holdings Inc Cinemark Holdings Inc. Common Stock,$16.51,-0.07,-0.422%,1950795729.00,United States,2007,2359935,Consumer Services,Movies/Entertainment
CNMD,CONMED Corporation Common Stock,$112.82,0.46,0.409%,3226832399.00,United States,1987,59350,Health Care,Biotechnology: Electromedical & Electrotherapeutic Apparatus
CNO,CNO Financial Group Inc. Common Stock,$22.82,0.18,0.795%,3171637814.00,United States,,397862,Finance,Accident &Health Insurance
CNP,CenterPoint Energy Inc (Holding Co) Common Stock,$21.58,0.08,0.372%,11757239770.00,United States,,1011209,Public Utilities,Electric Utilities: Central
CNR,Cornerstone Building Brands Inc. Common Stock,$9.94,0.04,0.404%,1243509049.00,United States,,282517,Capital Goods,Metal Fabrications
CNS,Cohen & Steers Inc Common Stock,$73.40,-0.45,-0.609%,3507472215.00,United States,2004,42546,Finance,Investment Managers
CNX,CNX Resources Corporation Common Stock,$11.46,-0.34,-2.881%,2573097561.00,United States,1999,1406572,Energy,Oil & Gas Production
CODI,D/B/A Compass Diversified Holdings Shares of Beneficial Interest,$19.62,0.10,0.512%,1273338000.00,United States,2006,60586,Consumer Durables,Home Furnishings
COF,Capital One Financial Corporation Common Stock,$97.30,0.48,0.496%,44504736954.00,United States,1994,960160,Finance,Major Banks
COG,Cabot Oil & Gas Corporation Common Stock,$16.94,-0.23,-1.34%,6751943184.00,United States,1990,1735896,Energy,Oil & Gas Production
COLD,Americold Realty Trust Common Shares,$36.40,0.27,0.747%,7456900942.00,United States,2018,598339,Consumer Services,Real Estate Investment Trusts
COO,The Cooper Companies Inc. Common Stock,$358.37,2.37,0.666%,17604471120.00,United States,,77099,Health Care,Ophthalmic Goods
COP,ConocoPhillips Common Stock,$39.49,-0.59,-1.472%,42175667236.00,United States,,3530252,Energy,Integrated oil Companies
COR,CoreSite Realty Corporation Common Stock,$124.68,-0.62,-0.495%,5332136571.00,United States,2010,70302,Consumer Services,Real Estate Investment Trusts
CORR,CorEnergy Infrastructure Trust Inc. Common Stock,$7.27,-0.33,-4.342%,99246558.00,United States,,190003,Consumer Services,Real Estate Investment Trusts
COTY,Coty Inc. Class A Common Stock,$7.18,-0.23,-3.104%,5499182793.00,United States,2013,5475239,Consumer Non-Durables,Package Goods/Cosmetics
CPB,Campbell Soup Company Common Stock,$48.55,0.44,0.915%,14707978973.00,United States,,673902,Consumer Non-Durables,Packaged Foods
CPE,Callon Petroleum Company Common Stock,$13.76,-0.32,-2.273%,546996767.00,United States,,1454905,Energy,Oil & Gas Production
CPF,Central Pacific Financial Corp New,$19.01,-0.16,-0.835%,535697960.00,United States,,81958,Finance,Major Banks
CPK,Chesapeake Utilities Corporation Common Stock,$107.06,0.39,0.366%,1869364596.00,United States,,17738,Public Utilities,Oil & Gas Production
CPS,Cooper-Standard Holdings Inc. Common Stock,$35.97,-0.68,-1.855%,607775234.00,United States,,58222,Capital Goods,Auto Parts:O.E.M.
CPT,Camden Property Trust Common Stock,$98.70,1.35,1.387%,9612941673.00,United States,1993,229309,Consumer Services,Real Estate Investment Trusts
CR,Crane Co. Common Stock,$76.89,0.40,0.523%,4467927657.00,United States,,75233,Capital Goods,Metal Fabrications
CRD/A,Crawford & Company,$7.49,0.00,0.00%,,United States,,11449,,
CRD/B,Crawford & Company,$7.80,0.01,0.128%,,United States,,238930,,
CRHC,Cohn Robbins Holdings Corp. Class A Ordinary Shares,$10.49,0.17,1.647%,1085715000.00,United States,2020,1158008,Finance,Business Services
CRHC.U,Cohn Robbins Holdings Corp. Units each consisting of one Class A ordinary share and one-third of one redeemable warrant,NA,,,,United States,2020,0,,
CRHC.WS,Cohn Robbins Holdings Corp. Redeemable warrants each whole warrant exercisable for one Class A ordinary share at an exercise price of $11.50,NA,,,,United States,,0,,
CRI,Carter's Inc. Common Stock,$95.01,-0.19,-0.20%,4146956196.00,United States,2003,136384,Consumer Non-Durables,Apparel
CRK,Comstock Resources Inc. Common Stock,$4.49,-0.19,-4.06%,1043572019.00,United States,,1661240,Energy,Oil & Gas Production
CRL,Charles River Laboratories International Inc. Common Stock,$251.71,-0.09,-0.036%,12520716390.00,United States,2000,150771,Health Care,Biotechnology: Commercial Physical & Biological Resarch
CRM,Salesforce.com Inc Common Stock,$225.78,-1.65,-0.725%,206588700000.00,United States,2004,6146282,Technology,Computer Software: Prepackaged Software
CRS,Carpenter Technology Corporation Common Stock,$28.63,0.12,0.421%,1374766992.00,United States,,228314,Basic Industries,Steel/Iron Ore
CRT,Cross Timbers Royalty Trust Common Stock,$8.50,0.13,1.553%,51000000.00,United States,1992,17329,Energy,Oil & Gas Production
CRY,CryoLife Inc. Common Stock,$23.53,-0.19,-0.801%,914315446.00,United States,,76447,Health Care,Medical/Dental Instruments
CSL,Carlisle Companies Incorporated Common Stock,$157.35,0.42,0.268%,8399172275.00,United States,,59689,Basic Industries,Specialty Chemicals
CSR,D/B/A Centerspace,$71.61,1.86,2.667%,929203913.00,United States,,24331,,
CSU,Capital Senior Living Corporation Common Stock,$12.90,-0.40,-3.008%,26891288.00,United States,1997,25655,Health Care,Hospital/Nursing Management
CSV,Carriage Services Inc. Common Stock,$30.84,0.35,1.148%,554189496.00,United States,,29945,Consumer Services,Other Consumer Services
CTAA,Qwest Corporation 7% Notes due 2056,$25.48,0.05,0.197%,0.00,United States,2016,3018,Public Utilities,Telecommunications Equipment
CTAC,Cerberus Telecom Acquisition Corp. Class A Ordinary Shares,$10.15,-0.07,-0.685%,0.00,United States,2020,79530,Finance,Business Services
CTAC.U,Cerberus Telecom Acquisition Corp. Units each consisting of one Class A ordinary share and one-third of one redeemable warrant,NA,,,,United States,2020,0,,
CTAC.WS,Cerberus Telecom Acquisition Corp. Warrants included as part of the Units each whole warrant exercisable for one Class A ordinary share at an exercise price of $11.50,NA,,,,United States,,0,,
CTB,Cooper Tire & Rubber Company Common Stock,$37.92,0.10,0.264%,1910179160.00,United States,,83291,Consumer Durables,Automotive Aftermarket
CTBB,Qwest Corporation 6.5% Notes due 2056,$25.54,0.03,0.118%,0.00,United States,2016,39649,Public Utilities,Telecommunications Equipment
CTDD,Qwest Corporation 6.75% Notes due 2057,$26.00,0.12,0.464%,0.00,United States,2017,36860,Public Utilities,Telecommunications Equipment
CTLT,Catalent Inc. Common Stock,$105.31,0.45,0.429%,17344304045.00,United States,2014,277767,Health Care,Major Pharmaceuticals
CTR,ClearBridge MLP and Midstream Total Return Fund Inc. Common Stock,$15.14,-0.06,-0.395%,116275624.00,United States,2012,32047,,
CTRA,Contura Energy Inc. Common Stock,$12.39,-0.32,-2.518%,226846503.00,United States,2018,44239,Energy,Coal Mining
CTS,CTS Corporation Common Stock,$33.70,-0.34,-0.999%,1087429949.00,United States,,38979,Technology,Electrical Products
CTT,CatchMark Timber Trust Inc. Class A Common Stock,$9.25,0.10,1.093%,451080847.00,United States,2013,77534,Consumer Services,Real Estate Investment Trusts
CUB,Cubic Corporation Common Stock,$60.73,0.15,0.248%,1914456650.00,United States,,52810,Capital Goods,Industrial Machinery/Components
CUBB,Customers Bancorp Inc 5.375% Subordinated Notes Due 2034,$25.76,0.06,0.233%,0.00,United States,2019,3102,Finance,Major Banks
CUBE,CubeSmart Common Shares,$33.70,0.33,0.989%,6580479129.00,United States,,267102,Consumer Services,Real Estate Investment Trusts
CUBI,Customers Bancorp Inc Common Stock,$17.94,0.06,0.336%,566927519.00,United States,,46107,Finance,Major Banks
CUK,Carnival Plc ADS ADS,$17.99,-0.21,-1.154%,15879275756.00,United States,,563652,Consumer Services,Marine Transportation
CULP,Culp Inc. Common Stock,$15.56,-0.16,-1.018%,191447050.00,United States,,8930,Basic Industries,Textiles
CUZ,Cousins Properties Incorporated Common Stock,$33.69,0.08,0.238%,5005133154.00,United States,,168096,Consumer Services,Real Estate Investment Trusts
CVA,Covanta Holding Corporation Common Stock,$13.07,0.11,0.849%,1725001799.00,United States,,342237,Basic Industries,Electric Utilities: Central
CVI,CVR Energy Inc. Common Stock,$14.66,-0.28,-1.874%,1473778581.00,United States,2007,195164,Energy,Integrated oil Companies
CVNA,Carvana Co. Class A Common Stock,$274.71,4.71,1.744%,47189412936.00,United States,2017,564128,Consumer Durables,Automotive Aftermarket
CVS,CVS Health Corporation Common Stock,$67.97,-0.04,-0.059%,88966850459.00,United States,,2117597,Health Care,Medical/Nursing Services
CVX,Chevron Corporation Common Stock,$85.33,-0.36,-0.42%,164261119769.00,United States,,3335646,Energy,Integrated oil Companies
CW,Curtiss-Wright Corporation Common Stock,$113.29,0.08,0.071%,4701764526.00,United States,,69224,Technology,Industrial Machinery/Components
CWEN,Clearway Energy Inc. Class C Common Stock,$32.67,-0.24,-0.729%,6587447793.00,United States,2015,346246,Public Utilities,Electric Utilities: Central
CWH,Camping World Holdings Inc. Class A Commom Stock,$29.19,0.09,0.309%,2590800892.00,United States,2016,398861,Consumer Durables,Automotive Aftermarket
CWT,California Water Service Group Common Stock,$53.01,0.27,0.512%,2642018400.00,United States,,57277,Public Utilities,Water Supply
CXE,MFS High Income Municipal Trust Common Stock,$4.91,0.07,1.446%,154770806.00,United States,1989,121746,,
CXH,MFS Investment Grade Municipal Trust Common Stock,$9.73,0.00,0.00%,88642684.00,United States,1989,2079,,
CXO,Concho Resources Inc. Common Stock,$57.46,-0.89,-1.525%,11279108746.00,United States,2007,467096,Energy,Oil & Gas Production
CXP,Columbia Property Trust Inc. Common Stock,$14.36,0.10,0.701%,1643717486.00,United States,2013,166754,Consumer Services,Real Estate Investment Trusts
CXW,CoreCivic Inc. Common Stock,$6.98,0.25,3.715%,835046828.00,United States,,790487,Consumer Services,Real Estate Investment Trusts
CYH,Community Health Systems Inc. Common Stock,$7.67,-0.07,-0.904%,917492702.00,United States,2000,439008,Health Care,Hospital/Nursing Management
D,Dominion Energy Inc. Common Stock,$74.23,0.19,0.257%,60558251422.00,United States,,1064984,Public Utilities,Electric Utilities: Central
DAL,Delta Air Lines Inc. Common Stock,$39.73,-0.51,-1.267%,25337183779.00,United States,,5176408,Transportation,Air Freight/Delivery Services
DAN,Dana Incorporated Common Stock ,$19.60,-0.11,-0.558%,2832027755.00,United States,,358714,Capital Goods,Auto Parts:O.E.M.
DAR,Darling Ingredients Inc. Common Stock,$56.09,0.38,0.682%,9090421268.00,United States,,184573,Consumer Non-Durables,Packaged Foods
DBD,Diebold Nixdorf Incorporated Common Stock,$10.73,-0.26,-2.366%,833489479.00,United States,,319966,Miscellaneous,Office Equipment/Supplies/Services
DBI,Designer Brands Inc. Class A Common Stock,$7.14,-0.12,-1.653%,516885142.00,United States,,656461,Consumer Services,Clothing/Shoe/Accessory Stores
DBL,DoubleLine Opportunistic Credit Fund Common Shares of Beneficial Interest,$19.15,-0.09,-0.468%,286424558.00,United States,2012,19859,,
DCI,Donaldson Company Inc. Common Stock,$56.57,-0.38,-0.667%,7141392218.00,United States,,124664,Capital Goods,Pollution Control Equipment
DCO,Ducommun Incorporated Common Stock,$53.44,0.20,0.376%,626027690.00,United States,,20710,Capital Goods,Military/Government/Technical
DCP,DCP Midstream  LP Common Units ,$18.84,0.13,0.695%,3925342788.00,United States,,168918,Public Utilities,Natural Gas Distribution
DCUE,Dominion Energy Inc. 2019 Series A Corporate Units,$98.91,0.20,0.203%,0.00,United States,2019,21580,Public Utilities,Electric Utilities: Central
DDD,3D Systems Corporation Common Stock,$11.55,-0.67,-5.483%,1433839349.00,United States,,2027199,Technology,Computer Software: Prepackaged Software
DDF,Delaware Investments Dividend & Income Fund Inc. Common Stock,$9.29,0.10,1.088%,71422988.00,United States,1993,7025,,
DDS,Dillard's Inc. Common Stock,$57.21,1.88,3.398%,1258499401.00,United States,,131290,Consumer Services,Department/Specialty Retail Stores
DDT,Dillard's Capital Trust I,$24.92,-0.08,-0.32%,0.00,United States,,7654,Consumer Services,Department/Specialty Retail Stores
DE,Deere & Company Common Stock,$269.21,1.27,0.474%,84359996111.00,United States,,289945,Capital Goods,Industrial Machinery/Components
DEA,Easterly Government Properties Inc. Common Stock,$22.19,0.02,0.09%,1802523989.00,United States,2015,389814,Consumer Services,Real Estate Investment Trusts
DECK,Deckers Outdoor Corporation Common Stock,$292.74,-2.81,-0.951%,8221327724.00,United States,1993,73140,Consumer Non-Durables,Shoe Manufacturing
DEI,Douglas Emmett Inc. Common Stock,$29.51,0.23,0.786%,5175312886.00,United States,2006,259029,Consumer Services,Real Estate Investment Trusts
DEX,Delaware Enhanced Global Dividend Common Shares of Beneficial Interest,$9.64,0.055,0.574%,115750719.00,United States,2007,7917,,
DFNS,LGL Systems Acquisition Corp. Common Stock,$10.45,0.012,0.115%,225328125.00,United States,2020,26369,Finance,Business Services
DFNS.U,LGL Systems Acquisition Corp. Units,NA,,,,United States,2020,0,,
DFNS.WS,LGL Systems Acquisition Corp. Redeemable Warrants each whole warrant exercisable for shares of Class A Common Stock at an exercise price of $11.50 per share,NA,,,,United States,,0,,
DFS,Discover Financial Services Common Stock,$88.29,-0.08,-0.091%,27060561152.00,United States,,592612,Finance,Finance: Consumer Services
DG,Dollar General Corporation Common Stock,$211.28,0.11,0.052%,51763790786.00,United States,2009,535702,Consumer Services,Department/Specialty Retail Stores
DGNR,Dragoneer Growth Opportunities Corp. Class A Ordinary Shares,$14.00,0.43,3.169%,1207500000.00,United States,2020,167864,Finance,Business Services
DGNR.U,Dragoneer Growth Opportunities Corp. Units each consisting of one Class A ordinary share and one-fourth of one redeemable warrant,NA,,,,United States,2020,0,,
DGNR.WS,Dragoneer Growth Opportunities Corp. Redeemable warrants each whole warrant exercisable for one Class A ordinary share at an exercise price of $11.50,NA,,,,United States,,0,,
DGX,Quest Diagnostics Incorporated Common Stock,$120.23,-0.60,-0.497%,16202914256.00,United States,,535298,Health Care,Medical Specialities
DHF,BNY Mellon High Yield Strategies Fund Common Stock,$3.00,0.00,0.00%,218123064.00,United States,1998,2049470,,
DHI,D.R. Horton Inc. Common Stock,$71.85,1.10,1.555%,26181492991.00,United States,,1634392,Capital Goods,Homebuilding
DHR,Danaher Corporation Common Stock,$221.49,0.92,0.417%,157341505166.00,United States,,610981,Capital Goods,Industrial Machinery/Components
DHX,DHI Group Inc. Common Stock,$2.03,-0.06,-2.871%,106447731.00,United States,2007,77760,Miscellaneous,Business Services
DIN,Dine Brands Global Inc. Common Stock,$61.50,-1.36,-2.164%,1009753064.00,United States,,200391,Consumer Services,Restaurants
DIS,Walt Disney Company (The) Common Stock,$173.73,0.18,0.104%,314535565478.00,United States,,2720964,Consumer Services,Services-Misc. Amusement & Recreation
DK,Delek US Holdings Inc. Common Stock,$15.44,-0.54,-3.379%,1138325704.00,United States,2017,313778,Energy,Integrated oil Companies
DKL,Delek Logistics Partners L.P. Common Units representing Limited Partner Interests,$30.00,0.19,0.637%,1302997170.00,United States,2012,21501,Energy,Natural Gas Distribution
DKS,Dick's Sporting Goods Inc Common Stock,$55.59,-0.21,-0.376%,4980790343.00,United States,2002,821395,Consumer Services,Other Specialty Stores
DLB,Dolby Laboratories Common Stock,$95.28,0.52,0.549%,9617067839.00,United States,2005,95129,Miscellaneous,Multi-Sector Companies
DLR,Digital Realty Trust Inc. Common Stock,$137.43,0.64,0.468%,38503101100.00,United States,2004,460148,Consumer Services,Real Estate Investment Trusts
DLX,Deluxe Corporation Common Stock,$26.14,1.01,4.019%,1095108846.00,United States,,181010,Consumer Durables,Publishing
DMO,Western Asset Mortgage Opportunity Fund Inc. Common Stock,$14.06,0.05,0.357%,154436137.00,United States,2010,24810,,
DMS,Digital Media Solutions Inc. Class A Ordinary Shares,$11.98,-0.12,-0.992%,699536651.00,United States,2018,89325,Miscellaneous,Business Services
DMS.WS,Digital Media Solutions Inc. Warrants ,NA,,,,United States,,0,,
DMYD,dMY Technology Group Inc. II Class A Common Stock,$16.61,0.03,0.181%,573045000.00,United States,2020,1172703,Finance,Business Services
DMYD.U,dMY Technology Group Inc. II Units each consisting of one share of Class A common stock and one-third of one redeemable warrant,NA,,,,United States,2020,0,,
DMYD.WS,dMY Technology Group Inc. II Redeemable Warrants,NA,,,,United States,,0,,
DMYI.U,dMY Technology Group Inc. III Units each consisting of one share of Class A common stock and one-fourth of one redeemable warrant,NA,,,,United States,2020,0,,
DNB,Dun & Bradstreet Holdings Inc. Common Stock,$26.49,-0.20,-0.749%,11206305468.00,United States,2020,281281,Finance,Finance: Consumer Services
DNP,DNP Select Income Fund Inc. Common Stock,$10.32,0.03,0.292%,3134625975.00,United States,1987,234939,,
DOC,Physicians Realty Trust Common Shares of Beneficial Interest,$17.98,0.15,0.841%,3743970941.00,United States,2013,415243,Consumer Services,Real Estate Investment Trusts
DOV,Dover Corporation Common Stock,$124.02,0.38,0.307%,17871691142.00,United States,,178269,Technology,Industrial Machinery/Components
DPG,Duff & Phelps Utility and Infrastructure Fund Inc.,$12.03,0.74,6.554%,456295566.00,United States,2011,1104414,,
DPZ,Domino's Pizza Inc Common Stock,$396.73,-7.02,-1.739%,15631124707.00,United States,2004,184260,Consumer Non-Durables,Food Distributors
DRE,Duke Realty Corporation Common Stock,$39.30,0.56,1.446%,14617681020.00,United States,,592519,Consumer Services,Real Estate Investment Trusts
DRH,Diamondrock Hospitality Company Common Stock,$8.41,0.06,0.719%,1677953781.00,United States,2005,645404,Consumer Services,Real Estate Investment Trusts
DRI,Darden Restaurants Inc. Common Stock,$117.89,-1.69,-1.413%,15349270337.00,United States,,507401,Consumer Services,Restaurants
DRQ,Dril-Quip Inc. Common Stock,$30.64,-0.31,-1.002%,1075335159.00,United States,1997,94260,Energy,Metal Fabrications
DRUA,Dominion Energy Inc. 2016 Series A 5.25% Enhanced Junior Subordinated Notes due 2076,$25.95,-0.01,-0.039%,0.00,United States,2016,51439,Public Utilities,Electric Utilities: Central
DS,Drive Shack Inc.,$2.80,0.00,0.00%,188238243.00,United States,,2264458,Consumer Services,Restaurants
DSE,Duff & Phelps Select MLP and Midstream Energy Fund Inc.,$4.95,-0.03,-0.602%,12985602.00,United States,2014,18519,,
DSM,BNY Mellon Strategic Municipal Bond Fund Inc. Common Stock,$7.65,0.02,0.262%,378074559.00,United States,1989,78491,,
DSU,Blackrock Debt Strategies Fund Inc. Common Stock,$10.21,0.02,0.196%,477656921.00,United States,1998,68411,,
DT,Dynatrace Inc. Common Stock,$43.18,-0.72,-1.64%,12180927518.00,United States,2019,649163,Technology,Computer Software: Prepackaged Software
DTB,DTE Energy Company 2020 Series G 4.375% Junior Subordinated Debentures due 2080,$27.14,0.00,0.00%,0.00,United States,2020,20229,Public Utilities,Electric Utilities: Central
DTE,DTE Energy Company Common Stock,$119.72,1.14,0.961%,23172954474.00,United States,,353245,Public Utilities,Electric Utilities: Central
DTF,DTF Tax-Free Income Inc. Common Stock,$14.70,0.03,0.204%,125254070.00,United States,1991,7585,,
DTJ,DTE Energy Company 2016 Series B 5.375% Junior Subordinated Debentures due 2076,$25.98,0.015,0.058%,0.00,United States,2016,13797,Public Utilities,Electric Utilities: Central
DTP,DTE Energy Company 6.25% Corporate Units,$47.14,0.3233,0.691%,0.00,United States,,14501,Public Utilities,Electric Utilities: Central
DTW,DTE Energy Company 2017 Series E 5.25% Junior Subordinated Debentures due 2077,$27.34,0.12,0.441%,0.00,United States,2017,24036,Public Utilities,Electric Utilities: Central
DTY,DTE Energy Company 2016 Series F 6.00% Junior Subordinated Debentures due 2076,$26.915,0.195,0.73%,0.00,United States,2016,13637,Public Utilities,Electric Utilities: Central
DUC,Duff & Phelps Utility & Corporate Bond Trust Inc. Common Stock,$10.12,0.04,0.397%,278246192.00,United States,1993,69262,,
DUK,Duke Energy Corporation (Holding Company) Common Stock,$89.67,0.63,0.708%,65993404075.00,United States,,733507,Public Utilities,Power Generation
DUKB,Duke Energy Corporation 5.625% Junior Subordinated Debentures due 2078,$28.445,0.025,0.088%,0.00,United States,2018,12322,Public Utilities,Power Generation
DUKH,Duke Energy Corporation 5.125% Junior Subordinated Debentures due 2073,$26.71,0.19,0.716%,0.00,United States,,23329,Public Utilities,Power Generation
DVA,DaVita Inc. Common Stock,$115.13,0.13,0.113%,12889204268.00,United States,,161890,Health Care,Misc Health and Biotechnology Services
DVD,Dover Motorsports Inc. Common Stock,$1.97,-0.02,-1.005%,71653593.00,United States,1996,11823,Consumer Services,Services-Misc. Amusement & Recreation
DVN,Devon Energy Corporation Common Stock,$15.33,-0.33,-2.107%,5863937397.00,United States,,2793211,Energy,Oil & Gas Production
DX,Dynex Capital Inc. Common Stock,$17.72,-0.09,-0.505%,410122418.00,United States,,91924,Consumer Services,Real Estate Investment Trusts
DY,Dycom Industries Inc. Common Stock,$73.92,0.11,0.149%,2359022487.00,United States,,115189,Basic Industries,Water Supply
EAF,GrafTech International Ltd. Common Stock,$9.10,0.16,1.79%,2431415778.00,United States,2018,634328,Energy,Industrial Machinery/Components
EAI,Entergy Arkansas LLC First Mortgage Bonds 4.875% Series Due September 1 2066,$25.97,-0.03,-0.115%,0.00,United States,2016,23543,Public Utilities,Electric Utilities: Central
EARN,Ellington Residential Mortgage REIT Common Shares of Beneficial Interest,$12.64,-0.01,-0.079%,155909799.00,United States,2013,16111,Consumer Services,Real Estate Investment Trusts
EAT,Brinker International Inc. Common Stock,$57.71,-0.34,-0.586%,2613653871.00,United States,,345993,Consumer Services,Restaurants
EB,Eventbrite Inc. Class A Common Stock,$18.75,-0.03,-0.16%,1718359200.00,United States,2018,208974,Technology,Computer Software: Programming Data Processing
EBF,Ennis Inc. Common Stock,$16.82,0.10,0.598%,438899835.00,United States,,60512,Consumer Services,Office Equipment/Supplies/Services
EBS,Emergent Biosolutions Inc. Common Stock,$93.84,-1.22,-1.283%,4973439204.00,United States,2006,176249,Health Care,Major Pharmaceuticals
ECC           ,Eagle Point Credit Company Inc. Common Stock,$10.18,-0.08,-0.78%,322456936.00,United States,2014,45248,,
ECCB,Eagle Point Credit Company Inc. 7.75% Series B Term Preferred Stock due 2026,$25.04,0.00,0.00%,0.00,United States,2016,7868,,
ECCX,Eagle Point Credit Company Inc. 6.6875% Notes due 2028,$24.8901,0.0201,0.081%,0.00,United States,2018,10165,,
ECCY,Eagle Point Credit Company Inc. 6.75% Notes due 2027,$25.008,-0.1269,-0.505%,0.00,United States,2017,1691,,
ECL,Ecolab Inc. Common Stock,$216.12,2.80,1.313%,61690412950.00,United States,,279242,Basic Industries,Package Goods/Cosmetics
ECOM          ,ChannelAdvisor Corporation Common Stock,$16.16,-0.45,-2.709%,468642424.00,United States,2013,125815,Technology,Computer Software: Prepackaged Software
ED,Consolidated Edison Inc. Common Stock,$70.44,0.37,0.528%,23591462472.00,United States,,843540,Public Utilities,Power Generation
EDD,Morgan Stanley Emerging Markets Domestic Debt Fund Inc. Morgan Stanley Emerging Markets Domestic Debt Fund Inc. Common Stock,$6.22,0.00,0.00%,411093018.00,United States,2007,83911,,
EDF,Stone Harbor Emerging Markets Income Fund Common Shares of Beneficial Interest,$8.01,-0.12,-1.476%,132822541.00,United States,2010,143235,,
EDI,Stone Harbor Emerging Markets Total Income Fund Common Shares of Beneficial Interests,$8.92,0.10,1.134%,87922281.00,United States,2012,28740,,
EEA,The European Equity Fund Inc. Common Stock,$10.4354,-0.0276,-0.264%,77798338.00,United States,,4863,,
EEX,Emerald Holding Inc. Common Stock,$5.16,0.06,1.176%,368633909.00,United States,2017,63015,Miscellaneous,Business Services
EFC,Ellington Financial Inc. Common Stock ,$15.11,-0.04,-0.264%,661541245.00,United States,2010,60651,Finance,Real Estate
EFL,Eaton Vance Floating-Rate 2022 Target Term Trust Common Shares of Beneficial Interest,$8.85,0.01,0.113%,209051266.00,United States,2017,63484,,
EFR,Eaton Vance Senior Floating-Rate Fund Common Shares of Beneficial Interest,$12.99,0.01,0.077%,478659586.00,United States,2003,52646,,
EFT,Eaton Vance Floating Rate Income Trust Common Shares of Beneficial Interest,$13.31,-0.03,-0.225%,512783057.00,United States,2004,77536,,
EFX,Equifax Inc. Common Stock,$193.96,1.09,0.565%,23593867552.00,United States,,153140,Finance,Finance: Consumer Services
EGF,Blackrock Enhanced Government Fund Inc. Common Stock,$13.31,0.11,0.833%,56720419.00,United States,2005,2624,,
EGHT,8x8 Inc Common Stock,$34.70,0.14,0.405%,3689353899.00,United States,,726480,Technology,EDP Services
EGP,EastGroup Properties Inc. Common Stock,$137.26,2.27,1.682%,5429584212.00,United States,,58612,Consumer Services,Real Estate Investment Trusts
EGY,VAALCO Energy Inc.  Common Stock,$1.74,-0.13,-6.952%,99973682.00,United States,,246455,Energy,Oil & Gas Production
EHC,Encompass Health Corporation Common Stock,$82.68,-0.28,-0.338%,8221076124.00,United States,,117132,Health Care,Hospital/Nursing Management
EHI,Western Asset Global High Income Fund Inc Common Stock,$10.10,-0.09,-0.883%,443061518.00,United States,2003,54646,,
